district,id,district_id,incident_type,incident,organization_type_id,organization_type,time,leadername,organization,organization_id,intotal,demand,leadername1,demand_id,demand_clean
Indore,972654,20,धरना,"दिनांक 27.02.25 को 11:00 कलेक्टर कार्यालय इंदौर में भारतीय किसान संघ के इंदौर जिला अध्यक्ष राजेंद्र पाटीदार के नेतृत्व में, किसानों की सहमति के बिना सरकार द्वारा भूमि अधिग्रहण किए जाने की प्रक्रिया का विरोध करता है। भारतीय किसान संघ विकास विरोधी नहीं है, परन्तु अंधाधुंध विकास जो किसान के संविधानिक हक़ का हनन कर रहा है उसे न्यायोचित भी नहीं मानता है। पूरा मालवा प्रान्त भूमि अधिग्रहण निति के विरोध में भारतीय किसान संघ द्वारा निम्नलिखित तीन सूत्रीय मांगों -1. सरकार कृषि भूमि की गाइडलाइन में पहले संशोधन करें बाद संशोधित गाइडलाइन का 4 गुना मुआवज़ा दे, 2. नीतिगत स्तर पर केंद्रीय भूमि अधिग्रहण कानून 2014 को ज्यो का त्यों सामान रूप से पुरे प्रदेश में लागू  करें,  3. किसानो की सहमति के बिना चल रहे सर्वे को तत्काल रूप से बंद करने आदि  को लेकर धरना दिया गया। शाम 21.30 बजे एडीएम रोशन राय द्वारा कलेक्‍टर इंदौर श्री आशीष सिंह से चर्चा पश्‍चात किसानों को आश्‍वासन दिया गया कि 7-8 दिन के अंदर भारतीय किसान संघ के प्रतिनिधि मण्‍डल की मुलाकात मान. मुख्‍यमंत्री महोदय से करवाई जावेगी। आपकी समस्‍या का समाधान मान. मुख्‍यमंत्री महोदय के स्‍तर पर ही किया जाना संभव है। इस प्रकार के लिखित आश्‍वासन पर भारतीय किसान संघ द्वारा धरना समाप्‍त किया गया। उपस्थिति 200-250 की रही।",3,कृषक संगठन,2025-02-28T14:02:54.000,राजेन्द्र पाटीदार,भाकिस,2,250,सहायता राशि/मुआवज़ा,17,10,सहायता राशि/मुआवज़ा
Tikamgarh,972864,40,ज्ञापन,"दिनांक 27-02-25 को भारतीय किसान संघ के द्वारा थाना जतारा अंतर्गत गल्‍लामंडी जतारा में तहसील जतारा, पलेरा, लिधौरा, मोहनगढ़ एवं दिगौडा के किसानों का कार्यकर्ता सम्‍मेलन जिलाध्‍यक्ष भारतीय किसान संघ शिवमोहन गिरि के नेतृत्‍व में समय 12-00 बजे से 15-00 बजे तक आयोजित किया गया। सम्‍मेलन पश्‍चात किसानों की समस्याओं जैसे-राजस्व महाभियान के दौरान नामांकन, खसरा से आधार लिंक का कार्य ना होना, सुजारा बांध की नहर से ग्राम पहाड़ीताल, तानगा, चरी, रामनगर, लिधौरा, गुड़ा ,पाली में सिंचाई हेतु पानी न मिलने, कृषि विभाग की योजनाओं का लाभ न मिलने आदि 05 सूत्रीय मांगों को लेकर एसडीएम जतारा को लगभग 200 की उपस्थिति में ज्ञापन सौंपा गया।",3,कृषक संगठन,2025-02-28T17:26:37.000,शिवमोहन गिरि,भाकिस,2,200,नहरों का पानी/सिचाई समस्या,12,7,नहरों का पानी/सिचाई समस्या
Gwalior,967147,16,अन्य,"दिनांक 05/02/25 को भारतीय किसान संघ मध्य भारत प्रांत के प्रादेशिक आव्हान पर किसानों की विविध समस्याओं जैसे खाद-बीज की कालाबाजारी, नकली खाद एवं दवाइयों पर रोक, राजस्व प्रकरणों का समय पर संतुष्टिपूर्ण निराकरण न होना, पर्याप्त सिंचाई बिजली न मिलने आदि समस्याओं को लेकर भोपाल में बल्लभ भवन का घेराव करने हेतु ग्वालियर जिले से प्रांत उपाध्यक्ष भूपेंद्र चौधरी व जिलाध्यक्ष रामाधार यादव के नेतृत्व में लगभग 150 की सँख्या में भारतीय किसान संघ के कार्यकर्ता ट्रेन द्वाराब दिनाक 04/02/25 को रात्रि में भोपाल रवाना हुए।",3,कृषक संगठन,2025-02-05T17:40:14.000,भूपेंद्र चौधरी,भाकिस,2,150,खाद की कमी: यूरिया(Urea) डीएपी(DAP)/काला बाजारी,14,5,खाद की कमी: यूरिया(Urea) डीएपी(DAP)/काला बाजारी
Gwalior,967147,16,अन्य,"दिनांक 05/02/25 को भारतीय किसान संघ मध्य भारत प्रांत के प्रादेशिक आव्हान पर किसानों की विविध समस्याओं जैसे खाद-बीज की कालाबाजारी, नकली खाद एवं दवाइयों पर रोक, राजस्व प्रकरणों का समय पर संतुष्टिपूर्ण निराकरण न होना, पर्याप्त सिंचाई बिजली न मिलने आदि समस्याओं को लेकर भोपाल में बल्लभ भवन का घेराव करने हेतु ग्वालियर जिले से प्रांत उपाध्यक्ष भूपेंद्र चौधरी व जिलाध्यक्ष रामाधार यादव के नेतृत्व में लगभग 150 की सँख्या में भारतीय किसान संघ के कार्यकर्ता ट्रेन द्वाराब दिनाक 04/02/25 को रात्रि में भोपाल रवाना हुए।",3,कृषक संगठन,2025-02-05T17:40:14.000,भूपेंद्र चौधरी,भाकिस,2,150,नहरों का पानी/सिचाई समस्या,14,7,नहरों का पानी/सिचाई समस्या
Seoni,967802,34,आमरण अनशन,"दिनांक 07/02/2025 को जिला सिवनी के थाना उगली अंतर्गत भारतीय किसान संघ जिला इकाई सिवनी के द्वारा केवलारी तहसील के उगली, सरेखा कला, पांडिया छपारा क्षेत्र में अवैध बिजली कटौती, लो वोल्टेज जैसी 06 सूत्रीय मांगो को लेकर किसानों द्वारा आनंद भगत जनपद सदस्‍य केवलारी के नेतृत्व में ग्राम पांडिया छपारा में दोपहर 12:00 बजे से आमरण अनशन प्रारंभ किया था जो विद्युत विभाग के वरिष्‍ठ अधिकारियों द्वारा दिनांक 13.02.2025 तक मेंटनेंस का कार्य पूर्ण कर 10 घंटे कृषि कार्य हेतु बिजली प्रदाय किये जाने का आश्‍वासन दिये जाने पर दिनांक 07.02.2025 के 18.15 बजे आमरण अनशन समाप्‍त किया गया ।",3,कृषक संगठन,2025-02-08T17:19:11.000,आनंद भगत,भाकिस,2,0,बिजली की समस्या,8,4,बिजली की समस्या
Indore,969491,20,अन्य,"दिनांक 15.02.25 को 11:20 बजे से 12:00  बजे तक भारतीय किसान संघ कार्यालय मल्हार आश्रम, मामा भांजे की दरगाह के पास इंदौर में भारतीय किसान संघ के संभाग अध्यक्ष कृष्णपाल सिंह राठौड़ के नेतृत्व में प्रेसवार्ता (15) आयोजित की गई lप्रेस वार्ता को संबोधित करते हुए इंदौर संभाग अध्यक्ष कृष्ण पाल सिंह राठौर ने कहा कि सरकार किसानों की सहमति के बगैर जमीन का अधिग्रहण नहीं कर सकती l इसके विरुद्ध दिनांक 17.02.25 को हम पूरे मालवा प्रांत की 112 तहसीलों में  एक साथ ज्ञापन देंगे l इसके बावजूद भी यदि सरकार नहीं चेती तो 27.02.25 से डेरा डालो घेरा डालो, ट्रैक्टर रैली आदि तरीकों से आंदोलन करेंगे l मुख्य रूप से भारतीय किसान संघ के जिला मंत्री धर्मेंद्र चौधरी, महानगर अध्यक्ष दिलीप मुकाती, सदस्य दिनेश पालीवाल उपस्थित रहे l",3,कृषक संगठन,2025-02-15T17:20:15.000,कृष्णपाल सिंह राठौड़,भाकिस,2,15,जमीनअधिग्रहण,20,12,जमीनअधिग्रहण
Khandwa,970310,24,ज्ञापन,"दिनांक 19.2.2025 को संयुक्त कृषक संगठन के खालवा तहसील अध्यक्ष मुकेश मालवीय के नेतृत्व में 15-20 पदाधिकारी एवं कार्यकर्ता को उपस्थिति में 14.00 बजे कस्बा खालवा के तहसील कार्यालय पहुंचकर किसानो की प्रमुख मांगे जैसे 1.खंडवा जिले में फरवरी के प्रथम सप्ताह से गेहूं एवं चने की फसल कटाई प्रारंभ हो जाती है अतः जिले के न्यूनतम समर्थन मूल्य पर गेहॅू चने की खरीदी 1 मार्च से प्रारंभ की जाए, जिसमें गेहूं 20 क्विंटल प्रति एकड़, चना 10 क्विटंल प्रति एकड़ की दर से समर्थन मूल्य पर खरीदी की जावे  2. समर्थन मूल्य पर विक्रय की गई उपज का भुगतान सप्ताह के भीतर किया जावे, 3. समर्थन मूल्य पर गेहूं चने की तुलाई प्लेट कांटे से की जावे, 4. सहकारी समितियां से लिए ऋण अदायगी की अंतिम तिथि 31 मार्च से बढ़कर 30 अप्रैल की जावे, 5. खालवा उद्यवहन सिंचाई योजना का कार्य इस ग्रीष्म काल तक पूर्ण किया जावे आदि मांगों के संबंध में माननीय मुख्यमंत्री महोदय के नाम संबोधित एक ज्ञापन हरसूद एसडीएम पुरूषोत्‍तम कुमार को दोपहर 14.15 बजे सोपा गया।",3,कृषक संगठन,2025-02-19T15:53:33.000,मुकेश मालवीय,अन्‍य,40,20,नहरों का पानी/सिचाई समस्या,12,7,नहरों का पानी/सिचाई समस्या
Khandwa,970310,24,ज्ञापन,"दिनांक 19.2.2025 को संयुक्त कृषक संगठन के खालवा तहसील अध्यक्ष मुकेश मालवीय के नेतृत्व में 15-20 पदाधिकारी एवं कार्यकर्ता को उपस्थिति में 14.00 बजे कस्बा खालवा के तहसील कार्यालय पहुंचकर किसानो की प्रमुख मांगे जैसे 1.खंडवा जिले में फरवरी के प्रथम सप्ताह से गेहूं एवं चने की फसल कटाई प्रारंभ हो जाती है अतः जिले के न्यूनतम समर्थन मूल्य पर गेहॅू चने की खरीदी 1 मार्च से प्रारंभ की जाए, जिसमें गेहूं 20 क्विंटल प्रति एकड़, चना 10 क्विटंल प्रति एकड़ की दर से समर्थन मूल्य पर खरीदी की जावे  2. समर्थन मूल्य पर विक्रय की गई उपज का भुगतान सप्ताह के भीतर किया जावे, 3. समर्थन मूल्य पर गेहूं चने की तुलाई प्लेट कांटे से की जावे, 4. सहकारी समितियां से लिए ऋण अदायगी की अंतिम तिथि 31 मार्च से बढ़कर 30 अप्रैल की जावे, 5. खालवा उद्यवहन सिंचाई योजना का कार्य इस ग्रीष्म काल तक पूर्ण किया जावे आदि मांगों के संबंध में माननीय मुख्यमंत्री महोदय के नाम संबोधित एक ज्ञापन हरसूद एसडीएम पुरूषोत्‍तम कुमार को दोपहर 14.15 बजे सोपा गया।",3,कृषक संगठन,2025-02-19T15:53:33.000,मुकेश मालवीय,अन्‍य,40,20,मूल्य न मिलना(Minimum Support Price(MSP)),12,8,मूल्य न मिलना(Minimum Support Price(MSP))
Sehore,967033,27,अन्य,"दिनांक 05.02.25 को भारतीय किसान संघ के प्रदेश आव्हान पर अन्नदाता अधिकार रैली एवं वल्लभ भवन भोपाल घेराव कार्यक्रम किसानों की मांगो- 1. फोती नामांतरण, बंटवारा सीमाकंन, आनलाईन रिकार्ड एवं नक्शा सुधारा जायें 2. ट्रांसफार्मर हॅार्स पॉवर क्षमता वृद्धि की जाए, जले हुये घरेलु एवं कृषि कनेक्शन की जांच कराकर कनेक्शन एवं बिल राशि समाप्त की जाए 3. डी.ए.पी,यूरिया खाद सहकारिता के माध्यम से नगद वितरण समय पर किया जायें 4.सभी मण्डियों में बडे तोल कांटे से तुलाई अनिवार्य कि जाए एवं मंडी परिसर में ही किसानों का भुगतान किया जाए 5.नकली दुध बनाने एवं बेचने वाले पर सख्त  कार्यवाही की जाए, गाय का दुध गुणवत्ता के आधार पर खरीदा जाए, गौ अभ्यारण्य बनाए जाए। 6.प्रस्तावित एवं स्वीकृत नहरों के कार्य जल्द पूर्ण किए जाए 7. सभी फसलों को समर्थन मूल्य से नीचे न खरीदा जाए 8. किसानों पर बनाए गए सभी प्रकार के झुठे प्रकरण वापस लिए जाए 9.पूसा,बासमती धान को जीआई टेग दिलाया जाए । उक्त कार्यक्रम में सम्मिलित होने भारतीय किसान संघ जिला अध्यक्ष राकेश वर्मा के नेतृत्व में जिला सीहोर से लगभग 200-250 की संख्या में प्रातः 08.00 बजे अपने निजी साधनों से भोपाल के लिए रवाना हुए ।",3,कृषक संगठन,2025-02-05T16:09:26.000,राकेश वर्मा,भाकिस,2,250,खाद की कमी: यूरिया(Urea) डीएपी(DAP)/काला बाजारी,24,5,खाद की कमी: यूरिया(Urea) डीएपी(DAP)/काला बाजारी
Sehore,967033,27,अन्य,"दिनांक 05.02.25 को भारतीय किसान संघ के प्रदेश आव्हान पर अन्नदाता अधिकार रैली एवं वल्लभ भवन भोपाल घेराव कार्यक्रम किसानों की मांगो- 1. फोती नामांतरण, बंटवारा सीमाकंन, आनलाईन रिकार्ड एवं नक्शा सुधारा जायें 2. ट्रांसफार्मर हॅार्स पॉवर क्षमता वृद्धि की जाए, जले हुये घरेलु एवं कृषि कनेक्शन की जांच कराकर कनेक्शन एवं बिल राशि समाप्त की जाए 3. डी.ए.पी,यूरिया खाद सहकारिता के माध्यम से नगद वितरण समय पर किया जायें 4.सभी मण्डियों में बडे तोल कांटे से तुलाई अनिवार्य कि जाए एवं मंडी परिसर में ही किसानों का भुगतान किया जाए 5.नकली दुध बनाने एवं बेचने वाले पर सख्त  कार्यवाही की जाए, गाय का दुध गुणवत्ता के आधार पर खरीदा जाए, गौ अभ्यारण्य बनाए जाए। 6.प्रस्तावित एवं स्वीकृत नहरों के कार्य जल्द पूर्ण किए जाए 7. सभी फसलों को समर्थन मूल्य से नीचे न खरीदा जाए 8. किसानों पर बनाए गए सभी प्रकार के झुठे प्रकरण वापस लिए जाए 9.पूसा,बासमती धान को जीआई टेग दिलाया जाए । उक्त कार्यक्रम में सम्मिलित होने भारतीय किसान संघ जिला अध्यक्ष राकेश वर्मा के नेतृत्व में जिला सीहोर से लगभग 200-250 की संख्या में प्रातः 08.00 बजे अपने निजी साधनों से भोपाल के लिए रवाना हुए ।",3,कृषक संगठन,2025-02-05T16:09:26.000,राकेश वर्मा,भाकिस,2,250,मूल्य न मिलना(Minimum Support Price(MSP)),24,8,मूल्य न मिलना(Minimum Support Price(MSP))
