district,id,district_id,incident_type,incident,organization_type_id,organization_type,time,leadername,organization,organization_id,intotal,demand,leadername1,demand_id,demand_clean
Khandwa,971903,24,ज्ञापन,"दिनांक 25.02.2025 को संयुक्त कृषक संगठन के जिला अध्यक्ष नरेंद्र पटेल के नेतृत्व में लगभग 4 -5 पदाधिकारी एवं कार्यकर्ताओं की उपस्थिति में किसानों की प्रमुख समस्याएं जैसे केंद्र सरकार के द्वारा व्यापारियों पर 2500 क्विंटल की स्टॉक लिमिट लगाना एवं 12 लाख टन गेहूं निर्यात कर किसानों  की कमर तोड़ने का कार्य किया जा रहा है, पूर्व की कांग्रेस सरकार के द्वारा किसानों के लिए  ऋण माफी योजना लाई गई थी परंतु वर्तमान सरकार ने सरकार गिरा कर किसानों से वादा किया था कि किसानों का सेवा सहकारी समितियां से डिफाल्टर किसानों का ब्याज सरकार भरेगी परंतु पूर्व सरकार ने कर्ज माफी एवं वर्तमान सरकार ने ब्याज माफी में किसानों को सेवा सहकारी समितियों मैं डिफॉल्टर कर दिया है जिस किसान का कर्ज़ मूलधन था आज वर्तमान में मूलधन के बराबर ब्याज होने,  जिले में फसल कटाई प्रारंभ हो चुकी है अतः 1 मार्च से गेहूं,चना खरीदी समर्थन मूल्य पर की जाए एवं₹500 प्रति क्विंटल अतिरिक्त बोनस दिया जाए, हरसूद मंडी में आए दिन किसानों की उपज तोलने एवं विक्रय में समस्या आ रही है आदि मांगों को लेकर कलेक्टर कार्यालय खंडवा पहुंचकर माननीय मुख्यमंत्री महोदय नाम संबोधित ज्ञापन खंडवा कलेक्टर को दोपहर 12.40 बजे सौंपा गया ।",3,कृषक संगठन,2025-02-25T16:07:55.000,नरेंद्र पटेल,अन्‍य,40,5,मूल्य न मिलना(Minimum Support Price(MSP)),12,8,मूल्य न मिलना(Minimum Support Price(MSP))
Khandwa,971904,24,ज्ञापन,दिनांक 25.02.25 को संयुक्‍त कृषक संगठन के कार्यकर्ता जीवन शर्मा के नेतृत्‍व में 40-50 पदाधिकारियो / कार्यकर्ताओ के द्वारा दोपहर 13.15 बजे किल्‍लोद तहसील कार्यालय पहुचकर मूंग की फसल की सिंचाई हेतु किल्‍लोद क्षेत्रांतर्गत नहरो में पानी छोडने की मांग के संबंध में कलेक्‍टर खण्‍डवा को संबोधित एक ज्ञापन किल्‍लोद तहसीलदार को सौपा गया।,3,कृषक संगठन,2025-02-25T16:09:40.000,जीवन शर्मा,अन्‍य,40,50,नहरों का पानी/सिचाई समस्या,10,7,नहरों का पानी/सिचाई समस्या
Ratlam,972006,45,बैठक,दूध के दाम में वृद्धि (5 रू. प्रति लीटर) करने को लेकर दिनांक 25.02.2025 को 13:30 बजे से 14:30 बजे तक दुग्ध उत्पादक संघ रतलाम जिलाध्यक्ष बाबूलाल चौधरी की अध्यक्षता में करीब 20 की उपस्थिति में थाना स्टेशन रोड रतलाम अंतर्गत कालिका माता मंदिर परिसर रतलाम में एक बैठक आयोजित की गयी। बैठक में सर्वसम्मति से निर्णय लिया गया कि- दुग्ध व्यापारियों द्वारा दिनांक 01.03.2025 से 55 रुपए प्रति लीटर के मान से दूध विक्रय किया जाएगा।\r\n  उल्लेखनीय है कि- यदि दूध के दाम व्यापारी नहीं बढ़ाते हैं तो सभी किसान दिनांक 01.03.2025 से स्वयं शहरों में दूध कम भाव में बेचने आयेंगे।,3,कृषक संगठन,2025-02-25T17:11:33.000,बाबूलाल चौधरी,अन्‍य,40,20,खाद की कमी: यूरिया(Urea) डीएपी(DAP)/काला बाजारी,13,5,खाद की कमी: यूरिया(Urea) डीएपी(DAP)/काला बाजारी
Rewa,972051,36,बैठक,"दिनांक 25.02.25 को पूर्व मुल्ता ई विधायक एवं किसान संघर्ष समिति के राष्ट्री य अध्यपक्ष डा0 सुनीलम का कार द्वारा सिंगरौली से समय 12.00 बजे रीवा आगमन हुआ जहां राज पैलेस रीवा में किसान संघर्ष  समिति की संभागीय बैठक समय 15.00 बजे से समय 17.00 बजे तक ली गयी। जिसमें न्यू्नतम समर्थन मूल्यअ, राष्ट्री य कृषि बाजार नीति, कर्जा मुक्ति व स्था नीय किसान समस्याजओं को लेकर आगामी आंदोलन की रणंनीति पर चर्चा की गयी कार्यक्रम में संयुक्त5 किसान मोर्चा , संभागीय कमेटी के लगभग 20 पदाधिकारी उपस्थित रहे। प्रमुख रूप से किसान संघर्ष समिति के राष्ट्री य प्रवक्ता  शिव सिंह, प्रदेश कार्यकारी अध्यदक्ष इंद्रजीत सिंह शंखू, प्रदेश सचिव शत्रुघन यादव आदि प्रमुख रूप से उपस्थित रहे। डा0 सुनीलम समय 20.00 बजे रेवांचल एक्स‍प्रेस ट्रेन से भोपाल के लिये प्रस्थान करेगें।",3,कृषक संगठन,2025-02-25T18:04:53.000,सुनीलम,किसान संघर्ष समिति,5,20,मूल्य न मिलना(Minimum Support Price(MSP)),6,8,मूल्य न मिलना(Minimum Support Price(MSP))
Rewa,972257,36,बैठक,"रीवा जिला के जवा  में दिनांक 26.02.2025 को  भारतीय किसान यूनियन टिकैत गुट के जिलाध्यक्ष सुग्रीव सिंह के नेतृत्व में 45 किसानों द्वारा दोपहर 15.00 बजे से समय 17.00 बजे तक किसान महापंचायत   आयोजित की गई। उक्त किसान महापंचायत में आवारा पशु,सिंचाई हेतु बिजली की कमी, न्यूनतम समर्थन मूल्य एवं अन्य स्थानीय मुद्दों पर चर्चा की गई।",3,कृषक संगठन,2025-02-26T17:03:26.000,सुग्रीव सिंह,भा0किसान यूनियन,7,45,नहरों का पानी/सिचाई समस्या,12,7,नहरों का पानी/सिचाई समस्या
Rewa,972257,36,बैठक,"रीवा जिला के जवा  में दिनांक 26.02.2025 को  भारतीय किसान यूनियन टिकैत गुट के जिलाध्यक्ष सुग्रीव सिंह के नेतृत्व में 45 किसानों द्वारा दोपहर 15.00 बजे से समय 17.00 बजे तक किसान महापंचायत   आयोजित की गई। उक्त किसान महापंचायत में आवारा पशु,सिंचाई हेतु बिजली की कमी, न्यूनतम समर्थन मूल्य एवं अन्य स्थानीय मुद्दों पर चर्चा की गई।",3,कृषक संगठन,2025-02-26T17:03:26.000,सुग्रीव सिंह,भा0किसान यूनियन,7,45,मूल्य न मिलना(Minimum Support Price(MSP)),12,8,मूल्य न मिलना(Minimum Support Price(MSP))
Khargone,972270,25,अन्य,"भारतीय किसान संघ - दिनांक 27.02.25 को 11:00 कलेक्टर कार्यालय इंदौर में भारतीय किसान संघ के इंदौर जिला अध्यक्ष राजेंद्र पाटीदार के नेतृत्व में, किसानों की सहमति के बिना सरकार द्वारा भूमि अधिग्रहण किए जाने की प्रक्रिया का विरोध करता है l भारतीय किसान संघ विकास विरोधी नहीं है, परन्तु अंधाधुंध विकास जो किसान के संविधानिक हक़ का हनन कर रहा है उसे न्यायोचित भी नहीं मानता है । पूरा मालवा प्रान्त भूमि अधिग्रहण निति के विरोध में । भारतीय किसान संघ द्वारा निम्नलिखित तीन सूत्रीय मांगों -1.सरकार कृषि भूमि की गाइडलाइन में पहले संशोधन करें बाद संशोधित गाइडलाइन का 4 गुना मुआवज़ा दे,2.नीतिगत स्तर पर केंद्रीय भूमि अधिग्रहण कानून 2014 को ज्यो का त्यों सामान रूप से पुरे प्रदेश में लागू  करें, 3.किसानो की सहमति के बिना चल रहे सर्वे को तत्काल रूप से बंद करने आदि  को लेकर माननीय मुख्यमंत्री महोदय को संबोधित ज्ञापन कलेक्टर इंदौर को दिया जाएगा l ज्ञापन में 200-250 की उपस्थिति संभावित है l जिसके अंतर्गत्‍ दिनांक 27.2.25 के प्रात: 8:00 बजे जिला खरगोन से भारतीय किसान संघ के संभागीय अध्‍यक्ष श्‍यामसिंग पंवार के नेतृत्‍व में 04-05 पदाधिकारी इंदौर रवाना होने की येाजना है।",3,कृषक संगठन,2025-02-26T17:15:26.000,श्‍यामसिंग पंवार,भाकिस,2,5,सहायता राशि/मुआवज़ा,16,10,सहायता राशि/मुआवज़ा
Indore,972536,20,धरना,"दिनांक 27.02.25 को 11:00 कलेक्टर कार्यालय इंदौर में भारतीय किसान संघ के इंदौर जिला अध्यक्ष राजेंद्र पाटीदार के नेतृत्व में, किसानों की सहमति के बिना सरकार द्वारा भूमि अधिग्रहण किए जाने की प्रक्रिया का विरोध करता हैl भारतीय किसान संघ विकास विरोधी नहीं है, परन्तु अंधाधुंध विकास जो किसान के संविधानिक हक़ का हनन कर रहा है उसे न्यायोचित भी नहीं मानता है। पूरा मालवा प्रान्त भूमि अधिग्रहण निति के विरोध में भारतीय किसान संघ द्वारा निम्नलिखित तीन सूत्रीय मांगों –\r\n\r\n1. सरकार कृषि भूमि की गाइडलाइन में पहले संशोधन करें बाद संशोधित गाइडलाइन का 4 गुना मुआवज़ा दे।\r\n2. नीतिगत स्तर पर केंद्रीय भूमि अधिग्रहण कानून 2014 को ज्यो का त्यों सामान रूप से पुरे प्रदेश में लागू  करें।\r\n3. किसानो की सहमति के बिना चल रहे सर्वे को तत्काल रूप से बंद करने आदि  को लेकर धरना दिया जा रहा है। उपस्थिति 200-250 की है। व माननीय मुख्यमंत्री महोदय को संबोधित ज्ञापन कलेक्टर इंदौर को दिया जाएगा l",3,कृषक संगठन,2025-02-27T16:50:05.000,राजेन्द्र पाटीदार,भाकिस,2,250,सहायता राशि/मुआवज़ा,17,10,सहायता राशि/मुआवज़ा
Khargone,972563,25,अन्य,"भारतीय किसान संघ - दिनांक 27.02.25 को 11:00 कलेक्टर कार्यालय इंदौर में भारतीय किसान संघ के इंदौर जिला अध्यक्ष राजेंद्र पाटीदार के नेतृत्व में, किसानों की सहमति के बिना सरकार द्वारा भूमि अधिग्रहण किए जाने की प्रक्रिया का विरोध करता है l भारतीय किसान संघ विकास विरोधी नहीं है, परन्तु अंधाधुंध विकास जो किसान के संविधानिक हक़ का हनन कर रहा है उसे न्यायोचित भी नहीं मानता है । पूरा मालवा प्रान्त भूमि अधिग्रहण निति के विरोध में । भारतीय किसान संघ द्वारा निम्नलिखित तीन सूत्रीय मांगों -1.सरकार कृषि भूमि की गाइडलाइन में पहले संशोधन करें बाद संशोधित गाइडलाइन का 4 गुना मुआवज़ा दे,2.नीतिगत स्तर पर केंद्रीय भूमि अधिग्रहण कानून 2014 को ज्यो का त्यों सामान रूप से पुरे प्रदेश में लागू  करें, 3.किसानो की सहमति के बिना चल रहे सर्वे को तत्काल रूप से बंद करने आदि  को लेकर माननीय मुख्यमंत्री महोदय को संबोधित ज्ञापन कलेक्टर इंदौर को दिया जाएगा l ज्ञापन में 200-250 की उपस्थिति संभावित है l जिसके अंतर्गत-  दिनांक 27.2.25 के प्रात: 8:00 बजे जिला खरगोन से भारतीय किसान संघ के संभागीय अध्‍यक्ष श्‍यामसिंग पंवार के नेतृत्‍व में 04-05 पदाधिकारी इंदौर रवाना हुए।",3,कृषक संगठन,2025-02-27T17:05:16.000,श्‍यामसिंग पंवार,भाकिस,2,5,सहायता राशि/मुआवज़ा,16,10,सहायता राशि/मुआवज़ा
Indore,972601,20,धरना,"दिनांक 27.02.25 को 11:00 कलेक्टर कार्यालय इंदौर में भारतीय किसान संघ के इंदौर जिला अध्यक्ष राजेंद्र पाटीदार के नेतृत्व में, किसानों की सहमति के बिना सरकार द्वारा भूमि अधिग्रहण किए जाने की प्रक्रिया का विरोध करता है l भारतीय किसान संघ विकास विरोधी नहीं है, परन्तु अंधाधुंध विकास जो किसान के संवैधानिक हक़ का हनन कर रहा है उसे न्यायोचित भी नहीं मानता है । पूरा मालवा प्रान्त भूमि अधिग्रहण निति के विरोध में । भारतीय किसान संघ द्वारा निम्नलिखित तीन सूत्रीय मांगों -\r\n\r\n01. सरकार कृषि भूमि की गाइडलाइन में पहले संशोधन करें ततपश्चात संशोधित गाइडलाइन का 4 गुना मुआवज़ा दे।\r\n\r\n02. नीतिगत स्तर पर केंद्रीय भूमि अधिग्रहण कानून 2014 को ज्यो का त्यों सामान रूप से पुरे प्रदेश में लागू  करें ।\r\n\r\n03. किसानो की सहमति के बिना चल रहे सर्वे को तत्काल बंद करने आदि- को लेकर धरना प्रारंभ किया गया l 16:20 बजे एडीएम रोशन राय, डीसीपी डॉ ऋषिकेश मीणा द्वारा आश्वासन दिया गया कि हम जॉइंट सर्वे रुकवा कर माननीय मुख्यमंत्री महोदय से आपकी मुलाक़ात का समय ले लेते हैं l जिला प्रशासन के इस आश्वासन पर किसान सहमत नहीं हुए तथा मांग की जा रही है कि भूमि अधिग्रहण राजपत्र निरस्त होने के बाद ही हम माननीय मुख्यमंत्री महोदय से मिलने जाएंगे l धरना कार्यक्रम में 200-250 की उपस्थिति है l मुख्य रूप से  संभाग अध्यक्ष कृष्णपाल सिंह राठौर ,जिला अध्यक्ष राजेंद्र पाटीदार संपर्क, प्रांतीय संगठन मंत्री सचिन जी माहेश, इंदौर जिला प्रचार प्रसार प्रमुख राहुल मालवीया, जिला मंत्री महेश राठौर, ए.डी.एम. रोशन राय , डी.सी.पी.डॉ.ऋषिकेस  एडीसीपी रामसनेही मिश्रा, ट्रैफिक ती श्रीमती राधा यादव, ट्रैफिक एसीपी श्रीमती सुप्रिया चौधरी आदि उपस्थित हैं l धरना 17:05 बजे जारी है l",3,कृषक संगठन,2025-02-27T17:34:16.000,राजेन्द्र पाटीदार,भाकिस,2,249250,सहायता राशि/मुआवज़ा,17,10,सहायता राशि/मुआवज़ा
