district,id,district_id,incident_type,incident,organization_type_id,organization_type,time,leadername,organization,organization_id,intotal,demand,leadername1,demand_id,demand_clean
Guna,967141,17,अन्य,"दिनांक 05-02-2025 को भारतीय किसान संघ के प्रांतीय आव्‍हान पर मध्‍य भारत प्रांत के प्रांत अध्‍यक्ष सर्वज्ञ दीवान के नेतृत्‍व में संगठन कार्यालय शिवाजी नगर भोपाल में प्रात: 10:00 बजे से एक दिवसीय धरना, प्रदर्शन, रैली एवं वल्‍लभ भवन घेराव व ज्ञापन कार्यक्रम में सम्मिलित होने के लिये गुना जिले से जिलाध्‍यक्ष बृजेश सिंह रघुवंशी के नेतृत्‍व में दिनांक 04-02-2025 को 18:00 बजे 100-125 कार्यकर्ता रेल द्वारा एवं दिनांक 05-02-2025 को 70-80 कार्यकर्ता प्रात: 07:00 बजे निजी वाहनों से भोपाल रवाना हुए।\r\n\r\nप्रमुख मांगे –\r\n\r\n1-    राजस्‍व– फौती, नामांतरण, बटवारा, सीमांकन, ऑनलाईन रिकार्ड एवं नक्‍शा सुधारा जायें।\r\n\r\n2-    बिजली- हॉर्स पावर क्षमता वृध्दि वापिस की जाये, एवं जले हुये ट्रांसफार्मर एवं लाईने समय सीमा मे बदले जायें, ओवरलोड ट्रांसफार्मरों की क्षमता मे वृध्दि की जायेगा, घरेलू एवं कृषि कनेक्‍शनों का मौके पर कुछ नही है उनकी जांच कराकर कनेक्‍शन एवं बिल राशि समाप्‍त किये जाये।\r\n\r\n3-    कृषि- डीएपी, यूरिया, खाद सहकारिता के माध्‍यम से नगद वितरण समय पर किया जाये।\r\n\r\n4-    मण्‍डी- सभी मण्डियों मे बडे फ्लेट कांटे से तुलाई अनिवार्य की जायेगा एवं मण्‍डी परिसर मे ही किसानों का भुगतान किया जाये।\r\n\r\n5- पशुपालन- नकली दूध बनाने वाले एवं बेचने वालों पर सख्‍त कार्यवाही की जाये, गाय का दूध गुणवत्‍ता के आधार पर खरीदा जाये, गौ-अभ्‍यारण्‍य बनाये जायें।\r\n\r\n6-    सिंचाई- प्रस्‍तावित एवं स्‍वीकृत नहरों के कार्य पूर्ण किये जायें।\r\n\r\n7-    सभी फसलों को समर्थन मूल्‍य से नीचे न खरीदा जाये।\r\n\r\n8-    किसानों पर बने सभी प्रकार के झूठे प्रकरण वापस लिये जायें।\r\n\r\n9-    पूसा बासमती धान को जी0आइ0 टेग दिलवाया जाये।",3,कृषक संगठन,2025-02-05T17:22:19.000,बृजेश सिंह रघुवंशी,भाकिस,2,200,नहरों का पानी/सिचाई समस्या,18,7,नहरों का पानी/सिचाई समस्या
Panna,967001,41,ज्ञापन,"दिनांक 05.02.25 को 13.00 बजे से 15.00 बजे तक भारतीय किसान संघ के जिलाध्यक्ष रामकृपाल पटेल के नेतृत्व में 50 ट्रेक्टरों के माध्यम से लगभग 200 किसानों द्वारा नगर पन्ना स्थित पॉलिटेक्निक ग्राउण्ड पन्ना में एकत्र होकर एक मंचीय कार्यक्रम पश्चात ट्रेक्टर रैली के रूप में पुराना पावर हाउस, गांधी चौक, कचहरी चौराहा, अजयगढ चौराहा होते हुये कलेक्ट्रेट कार्यालय पन्ना पहुंचकर एक ज्ञापन माननीय मुख्यमंत्री एवं कृषि मंत्री महोदय के नाम संबोधित अपर कलेक्टर पन्ना को सौंपते हुये किसानों का गेहॅू 2700 रूपये एवं धान 3100 रूपये प्रति क्विंटल शासन द्वारा क्रय किये जाने, 25000 रूपये में किसान को निजी ट्रांसफार्मर दिये जाने, फसल बीमा का लाभ गांव की इकाई या पटवारी हल्का मान्य कर दिया जाये, पन्ना जिले के औद्योगिक क्षेत्र महेबा, देवरा-पुरैना या अन्य तहसील के अंतर्गत क्षेत्रीय जमीनों के रजिस्ट्री रेट अपडेट कराये जाने आदि 11 सूत्रीय स्थानीय समस्याओं के निराकरण की मांग की गई । उक्त कार्यक्रम में भारतीय किसान संघ महाकौशल प्रांत के संगठन मंत्री श्री भरत जी भी शामिल रहे ।",3,कृषक संगठन,2025-02-05T18:19:57.000,रामकृपाल पटेल,भाकिस,2,200,फसल बीमा,13,1,फसल बीमा
Barwani,967213,4,बैठक,"भारतीय किसान संघ:- दिनांक 05.02.25 को बडवानी जिला मुख्‍यालय पर भारतीय किसान संघ के जिला अध्‍यक्ष भगवान पटेल के नेतृत्‍व में दोपहर 14.20 बजे से 16.00 बजे राजघाट रोड स्थित कृषि उपज मंडी परिसर में मासिक बैठक आयोजित की गई। बैठक में किसान संघ के द्वारा आयोजित अन्‍न दान कार्यक्रम चलाने, फसलों का समर्थन मूल्य बढ़ाने,  क्षतिग्रस्त नहरों को सुधारने, सोसायटी में खाद उपलब्ध कराने आदि स्थानीय समस्याओं को लेकर चर्चा की गई। जिसमें लगभग 08-10 पदाधिकारियों की उपस्थिति रही।",3,कृषक संगठन,2025-02-06T15:48:18.000,भगवान पटेल,अभाकिसं,1,8,मूल्य न मिलना(Minimum Support Price(MSP)),10,8,मूल्य न मिलना(Minimum Support Price(MSP))
Seoni,967596,34,आमरण अनशन,"दिनांक 07/02/2025 को जिला सिवनी के थाना उगली अंतर्गत भारतीय किसान संघ जिला इकाई सिवनी के द्वारा केवलारी तहसील के उगली, सरेखा कला, पांडिया छपारा क्षेत्र में अवैध बिजली कटौती, लो वोल्टेज जैसी 06 सूत्रीय मांगो को लेकर किसानों द्वारा आनंद भगत जनपद सदस्‍य केवलारी के नेतृत्व में ग्राम पांडिया छपारा में दोपहर 12:00 बजे से आमरण अनशन प्रारंभ किया गया है, जो जारी है। उक्‍त कार्यक्रम में लगभग 250-300 की उपस्थिति रही । दिनांक 08/02/2025 को क्षेत्र के उगली, पांडिया छपारा, सरेखा के बाजार बंद रखकर समस्त कृषक, मजदूर, व्यापारी, महिला, युवा एवं क्षेत्रवासियों के द्वारा चक्का जाम किया जावेगा।",3,कृषक संगठन,2025-02-07T17:39:37.000,आनंद भगत,भाकिस,2,300,बिजली की समस्या,8,4,बिजली की समस्या
Khandwa,968893,24,ज्ञापन,"दिनांक 13.2.25 को संयुक्‍त कृषक संगठन के जिला अध्‍यक्ष नरेन्‍द्र पटेल के नेतृत्‍व में 30-35 पदाधिकारी /कार्यकर्ताओ की उपस्थिति में शहर खण्‍डवा के जलेबी चौक स्थित पुरानी अनाज मंडी परिसर में दोपहर 13.10 बजे से 14.50 बजे तक बैठक आयोजित की गई। उक्‍त बैठक में किसानो की समस्‍या जैसे वर्ष 2022-23, 2023-24 की फसल बीमा राशि, गेहॅू एवं चने के समर्थन मुल्‍य पर 500 रूपये प्रति क्विंटल बोनस राशी दिये जाने, सदस्‍यता अभियान, समर्थन मुल्‍य पर गेहॅू प्रति एकड 20 क्विंटल, चना 12 क्विंटल प्रति एकड की दर से खरिदा जावे, समर्थन मुल्‍य पर खरीदी 01 मार्च से प्रारंभ की जावे, समर्थन मुल्‍य पर विक्रय की उपज का भुगतान 08 दिवस के अंदर किया जाना सुनिश्चित किया जावे, सहकरी समितियो से लिये गये ऋण 31 मार्च से बढाकर 30 अप्रैल किया जाना, खालवा उदवहन सिंचाई परियोजना का कार्य ग्रीष्म काल में पुर्ण किया जावे, सहकारी समितियो कृषक विपणन सहकारी समितियो एवं कृषि उपज मंडियो में चुनाव शीघ्र किया जावे ताकि चुने हुए कृषक प्रतिनिधियो के निर्देशन में संस्‍थाए सुचारू रूप से चल सके आदि के संबंध में चर्चा की गई। बैठक पश्‍चात संयुक्‍त कृषक संगठन के जिला उपाध्‍यक्ष सचिन मिश्रा के द्वारा 15.15 बजे कलेक्‍टर कार्यालय खण्‍डवा पहुचकर अपनी मांगो के संबंध में माननीय मुख्‍यमंत्री महोदय को संबोधित एक ज्ञापन आवक-जावक शाखा में दिया गया।",3,कृषक संगठन,2025-02-13T15:36:41.000,नरेन्‍द्र पटेल,अन्‍य,40,35,फसल बीमा,14,1,फसल बीमा
Khandwa,968893,24,ज्ञापन,"दिनांक 13.2.25 को संयुक्‍त कृषक संगठन के जिला अध्‍यक्ष नरेन्‍द्र पटेल के नेतृत्‍व में 30-35 पदाधिकारी /कार्यकर्ताओ की उपस्थिति में शहर खण्‍डवा के जलेबी चौक स्थित पुरानी अनाज मंडी परिसर में दोपहर 13.10 बजे से 14.50 बजे तक बैठक आयोजित की गई। उक्‍त बैठक में किसानो की समस्‍या जैसे वर्ष 2022-23, 2023-24 की फसल बीमा राशि, गेहॅू एवं चने के समर्थन मुल्‍य पर 500 रूपये प्रति क्विंटल बोनस राशी दिये जाने, सदस्‍यता अभियान, समर्थन मुल्‍य पर गेहॅू प्रति एकड 20 क्विंटल, चना 12 क्विंटल प्रति एकड की दर से खरिदा जावे, समर्थन मुल्‍य पर खरीदी 01 मार्च से प्रारंभ की जावे, समर्थन मुल्‍य पर विक्रय की उपज का भुगतान 08 दिवस के अंदर किया जाना सुनिश्चित किया जावे, सहकरी समितियो से लिये गये ऋण 31 मार्च से बढाकर 30 अप्रैल किया जाना, खालवा उदवहन सिंचाई परियोजना का कार्य ग्रीष्म काल में पुर्ण किया जावे, सहकारी समितियो कृषक विपणन सहकारी समितियो एवं कृषि उपज मंडियो में चुनाव शीघ्र किया जावे ताकि चुने हुए कृषक प्रतिनिधियो के निर्देशन में संस्‍थाए सुचारू रूप से चल सके आदि के संबंध में चर्चा की गई। बैठक पश्‍चात संयुक्‍त कृषक संगठन के जिला उपाध्‍यक्ष सचिन मिश्रा के द्वारा 15.15 बजे कलेक्‍टर कार्यालय खण्‍डवा पहुचकर अपनी मांगो के संबंध में माननीय मुख्‍यमंत्री महोदय को संबोधित एक ज्ञापन आवक-जावक शाखा में दिया गया।",3,कृषक संगठन,2025-02-13T15:36:41.000,नरेन्‍द्र पटेल,अन्‍य,40,35,नहरों का पानी/सिचाई समस्या,14,7,नहरों का पानी/सिचाई समस्या
Sagar,970048,39,ज्ञापन,"दिनांक 18.02.25 को राकेश जैन किसान खुरई जिला सागर के नेतृत्व में (15) द्वारा ज्ञापन अपर कलेक्टर सागर को सौंपा गया। जिसमें खुरई तहसील के करीब (66) किसानों का वर्ष 2022-23 में एमएसपी पर विपणन संघ खुरई द्वारा चना खरीदी की गई थी। जिसका 28% भुगतान प्राप्त हुआ है  शेष राशि करीब 72 लाख का भुगतान होना बाकी है, दोषी समिति कर्मचारियों पर शीघ्र कार्यवाही करते हुए शीघ्र भुगतान कराने की मांग की गई।",3,कृषक संगठन,2025-02-18T15:50:29.000,राकेश जैन,किसान,13,15,मूल्य न मिलना(Minimum Support Price(MSP)),9,8,मूल्य न मिलना(Minimum Support Price(MSP))
Burhanpur,970105,8,ज्ञापन,प्रगतिशील किसान संघ - दिनांक 18.02.2025 को दोपहर 13:00 बजे प्रगतिशील किसान संघ संरक्षक शिवकुमार कुशवाहा के नेतृत्व में तरबूज की फसल का मुआवजा दिया जाने केला फसल का बीमा कराए जाने इत्यादि मांगों को लेकर संयुक्त जिला कार्यालय पहुंचकर माननीय मुख्यमंत्री महोदय को संबोधित ज्ञापन कलेक्टर महोदय को दिया गया। उक्त ज्ञापन के दौरान प्रगतिशील किसान संघ के 10-12 कार्यकर्ता/पदाधिकारी की उपस्थिति रही।,3,कृषक संगठन,2025-02-18T16:31:52.000,शिवकुमार कुशवाहा,अन्‍य,40,1012,फसल बीमा,16,1,फसल बीमा
Khandwa,971362,24,ज्ञापन,"दिनांक 23.02.2025 को भारतीय किसान संघ के हरसूद तहसील अध्यक्ष रविंद्र बिश्नोई के नेतृत्व में 3-4 पदाधिकारी /कार्यकर्ताओं की उपस्थिति में 12.15 बजे एसडीएम कार्यालय हरसूद पहुचकर किसानो की प्रमुख समस्‍या - समर्थन मूल्य पर उपार्जन केंद्रों पर गेहूं एवं चने की उपज खरीदी में छोटे इलेक्ट्रॉनिक कांटे पर तुलाई होती है, जिसके कारण उपार्जन केंद्रों पर लंबी-लंबी ट्रैक्टरों की लाइन लगी रहती है एवं दो से तीन दिवस तक तुलाई का इंतजार करना पड़ता है, किसानों की मांग है कि उपार्जन केंद्रों पर बड़े इलेक्ट्रॉनिक कांटे लगाए जाने की मांग को लेकर,, कलेक्टर महोदय के नाम संबोधित एक ज्ञापन लिपिक शिवम शर्मा को सोपा गया।",3,कृषक संगठन,2025-02-23T15:39:37.000,रविंद्र बिश्नोई,भाकिस,2,4,मूल्य न मिलना(Minimum Support Price(MSP)),15,8,मूल्य न मिलना(Minimum Support Price(MSP))
Rewa,971717,36,अन्य,"रीवा जिला के जवा  में दिनांक 26.02.2025 को  भारतीय किसान यूनियन टिकैत गुट के जिलाध्यक्ष सुग्रीव सिंह के नेतृत्व में 100 किसानों द्वारा दोपहर 03बजे से शाम 05 बजे तक किसान महापंचायत आयोजित करने का निर्णय लिया गया है।उक्त किसान महापंचायत में आवारा पशु,सिंचाई हेतु बिजली की कमी, न्यूनतम समर्थन मूल्य एवं अन्य स्थानीय मुद्दों पर चर्चा की जाएगी।",3,कृषक संगठन,2025-02-24T16:52:34.000,सुग्रीव सिंह,भारतीय किसान यूनियन (महेन्द्र सिंह टिकैत गुट),37,100,नहरों का पानी/सिचाई समस्या,12,7,नहरों का पानी/सिचाई समस्या
Rewa,971717,36,अन्य,"रीवा जिला के जवा  में दिनांक 26.02.2025 को  भारतीय किसान यूनियन टिकैत गुट के जिलाध्यक्ष सुग्रीव सिंह के नेतृत्व में 100 किसानों द्वारा दोपहर 03बजे से शाम 05 बजे तक किसान महापंचायत आयोजित करने का निर्णय लिया गया है।उक्त किसान महापंचायत में आवारा पशु,सिंचाई हेतु बिजली की कमी, न्यूनतम समर्थन मूल्य एवं अन्य स्थानीय मुद्दों पर चर्चा की जाएगी।",3,कृषक संगठन,2025-02-24T16:52:34.000,सुग्रीव सिंह,भारतीय किसान यूनियन (महेन्द्र सिंह टिकैत गुट),37,100,मूल्य न मिलना(Minimum Support Price(MSP)),12,8,मूल्य न मिलना(Minimum Support Price(MSP))
