district,id,district_id,incident_type,incident,organization,time,leadername,organization_type,intotal,demand,organization_type_id,organization_id,leadername1,demand_id,demand_clean
Jhabua,280888,22,अन्य,"दिनांक 19.03.18 को तह.पेटलावद में भारतीय किसान यूनियन के जिलाध्यक्ष महेन्द्र  हामड़ के नेतृत्वय में 25-30 की संख्या  में 17.15 बजे तहसील कार्यालय पेटलावद पहुंचकर मुख्ययमंत्री महोदय के नाम एक ज्ञापन नायब तहसीलदार जितेन्द्रज अलावा को सोंपा गया जिसमें मांग की गई की लहसून की फसल को भावांतर भुगतान योजना में शामिल किया जाये, दूध के भाव बढ़ाये जाये, बैंक द्वारा किसानों को फसल बीमा की राशी समय पर नहीं मिल रही है, टमाटर की फसल का भाव सही नहीं मिल रहा है, मंडी में किसानों से 10 प्रतिशत टेक्सर लिया जाता है उसे बंद किया जाये, भावांतर भुगतान योजना अंतर्गत सोयाबीन की फसल का भुगतान नहीं हुआ है राशी खातों में जमा करवाई जाये।",भा0किसान यूनियन,1970-01-01 00:25:21.562144,महेन्द्र  हामड़,['कृषक संगठन'],25,भावंतर राशि,3,7,15,13,भावंतर राशि
Jhabua,280888,22,अन्य,"दिनांक 19.03.18 को तह.पेटलावद में भारतीय किसान यूनियन के जिलाध्यक्ष महेन्द्र  हामड़ के नेतृत्वय में 25-30 की संख्या  में 17.15 बजे तहसील कार्यालय पेटलावद पहुंचकर मुख्ययमंत्री महोदय के नाम एक ज्ञापन नायब तहसीलदार जितेन्द्रज अलावा को सोंपा गया जिसमें मांग की गई की लहसून की फसल को भावांतर भुगतान योजना में शामिल किया जाये, दूध के भाव बढ़ाये जाये, बैंक द्वारा किसानों को फसल बीमा की राशी समय पर नहीं मिल रही है, टमाटर की फसल का भाव सही नहीं मिल रहा है, मंडी में किसानों से 10 प्रतिशत टेक्सर लिया जाता है उसे बंद किया जाये, भावांतर भुगतान योजना अंतर्गत सोयाबीन की फसल का भुगतान नहीं हुआ है राशी खातों में जमा करवाई जाये।",भा0किसान यूनियन,1970-01-01 00:25:21.562144,महेन्द्र  हामड़,['कृषक संगठन'],25,फसल बीमा,3,7,15,1,फसल बीमा
Sagar,280928,39,अन्य,"दि.20.3.18 को 1400 बजे डॉ0 हरिसिंह गौर केन्द्रीय विश्वविदयालय परिसर सागर से किसानो का कर्ज माफ किये जाने की मांग को लेकर श्री घनश्याम दास पटेल संभागीय अध्यक्ष ओबीसी महासभा सागर एवं किसान मोर्चा के नेतृत्व में किसान (20) पैदल भोपाल प्रस्थान किये । इस दौरान तीनबत्तीं सागर पर 1500 बजे श्रीमति रेखा चौधरी जिला शहर कांग्रेस अध्यक्ष सागर एवं श्री अरूणोदय चौबे पूर्व विधायक खुरई यात्रा में शामिल होकर भावांतर की जगह पुराने भाव देने की शासन से मांग की गई बाद यात्रा भोपाल के लिए रवाना हुई, जो रात्रि मुकीम राहतगढ में करेगे । दि.21.3.18 को राहतगढ से प्रस्थान कर बेगमगंज जिला रायसेन होते हुए दि.24.3.18 को मुख्यमंत्री निवास भोपाल पहुंचकर किसानो का कर्ज माफ किये जाने एवं भावांतर का लाभ दिये जाने की मांग की जावेगी।",किसान मोर्चा,1970-01-01 00:25:21.565095,श्री घनश्याम दास पटेल संभागीय अध्यक्ष ओबीसी महासभा सागर एवं किसान मोर्चा,['कृषक संगठन'],20,भावंतर राशि,3,3,72,13,भावंतर राशि
Hoshangabad,281297,19,अन्य,दिनांक 20.03.18 को ग्राम डोगर वाडा तहसील होशंगाबाद में किसान राजेन्द्रं उर्फ राजू कुचबदिंया की गेहू की खडी 3 एकड फसल में आग लगने से फसल जल गई । फसल जलने का कारण सार्ट सर्किट बताया जा रहा है । इसी प्रकार तहसील सिवनी मालवा के ग्राम कासखेडी में किसान रमेश रघुवंशी की खडी गेहू की फसल में अज्ञात कारण से आग लगने से 3 एकड गेहू की फसल जल गई है ।,,1970-01-01 00:25:21.649673,अन्‍य,['कृषक संगठन'],0,फ़सल ख़राब/फसल अफलन,3,null,5,0,फ़सल ख़राब/फसल अफलन
Damoh,281308,12,अन्य,"किसान सम्मे लन:-  दिनांक 19—3-2018 को  जिला स्तारीय किसान सम्मेदलन तथा राहत राशि वितरण का कार्यक्रम दोपहर 12.00 बजे से 13.30 बजे तक तहसील ग्रांउड दमोह में मान. जयंत मलैया वित्तममंत्री म0प्र0 शासन के मुख्य  आतिथ्यर तथा सांसद दमोह प्रहलाद पटैल की अध्ययक्षता में (2000) की उपस्थिति में आयेाजित किया जाकर किसानो को राहत राशि वितरित की गई। कार्यक्रम में बुन्देतलखंड विकास प्राधिकरण अध्याक्ष डॉ0 रामकृष्ण  कुसमरिया, जिला पंचायत अध्यअक्ष दमोह शिवचरण पटैल, हटा विधायक उमादेवी खटीक, पथरिया विधायक-लखन लाल पटैल, जिला सहकारी केन्द्रीय  बैंक दमोह अध्याक्ष राजेन्द्रक गुरू उपस्थित रहे।",भारतीय किसान मोर्चा (बीजेपी),1970-01-01 00:25:21.650094,मान. जयंत मलैया वित्त्मंत्री म0प्र0 शासन   की  उपस्थितिमें,['कृषक संगठन'],2000,सहायता राशि/मुआवज़ा,3,24,58,10,सहायता राशि/मुआवज़ा
Indore,281309,20,अन्य,"भारतीय किसान यूनियन – दिनांक 21.03.18 को प्रात: 10.00 बजे लक्ष्मी बाई अनाज मण्डी  इंदौर पर व्याीपारियों द्वारा किसानों के गेहॅू की बोली कम लगाए जाने के विरोध में भारतीय किसान यूनियन के जिलाध्यंक्ष बबलू जाधव एवं  युवा किसान सेना के प्रदेश अध्यकक्ष मुकेश पटवारी के नेतृत्वन में 50-60 किसानों द्वारा मण्डी‍ गेट पर एकत्रित होकर माननीय मुख्यामंत्री महोदय द्वारा घोषित समर्थन मूल्यी 1735 रूपए प्रति क्विंटल के भाव से गेहूँ खरीदने की मांग को लेकर मण्डीम के गेट पर धरना प्रांरभ किया बाद 11.30 बजे एसडीएम राकेश शर्मा द्वारा धरना देने वाले किसानों से चर्चा की, जिसमें किसानों ने बताया कि दो दिन पहले गेहॅू के भाव यहा के व्या्पारियों द्वारा 2100 रूपए तक प्रति क्विंटल तक  लगाए थे दो दिन में भाव गिराकर 1500 से 1600 रूपए तक ले आए है। हमें समर्थन मूल्यर 1735 रूपए प्रति क्विंटल का भाव दिया जाए जिस पर एसडीएम राकेश शर्मा ने कहा कि आप यहा पर 1735 रूपए का भाव आए तो ही आप व्याापारियों को बेचे इससे कम भाव लगाते है तो हमारी समिति आपके गेहॅू 1735 रूपए में खरीदेगी। बाद धरना समाप्त  हुआ। व्यासपारियों द्वारा कहा गया कि अब आप अपना माल 1735 रूपए में सरकार को ही बेचे और उन्हो नें बोली नहीं लगायी। बाद इंदौर कलेक्टहर श्री निशांत वरवडे 11.45 बजे लक्ष्मींबाई अनाज मण्डी  किला मैदान इंदौर आए यहा किसानों से चर्चा कि जिसमें किसानों ने उक्तश समस्या  बतायी तथा कहा कि गेहॅू के तुलते ही हमें चैक भी दे दिया जाए चाहे 15 दिन बाद का हो जिस पर कलेक्टार महोदय ने कहा कि यहा जो  भी किसान आए है उनका माल खरीदा जाएगा चाहे उन्हें  एसएमएस नहीं आए हो, किन्तुे वह संस्थाी में पंजीकृत होना जरूरी है। यदि कोई पंजीकृत नहीं है तो पंजीकृत करने हेतु यही शिविर लगवा देगे, जिसमें वह अपने कागज पेश करें और पटवारी के खाताबही से उसका मिलान  होने पर उसे पंजीकृत कर लिया जावेगा। चूंकि आप लोग दूर-दूर से भाडे की ट्राली में अपना माल लाए है और आपके घर में शादी व्यारह हो तो अपना माल समृद्धि योजना अंतर्गत यहां जमा कराकर अपना काम करके आ जाए और बेच दे उसको भाड़ा नहीं लगेगा। और आपने कहा कि व्यांपारी माल देखकर बोली लगाता है यदि किसानों को लगता है कि वह कम भाव लगा रहा है तो यहा छन्नेय पर अपना माल साफ कराकर फिर वह व्याापारी के पास जाए, व्याहपारी माल का सही दा",भा0किसान यूनियन,1970-01-01 00:25:21.650267,जिलाध्यंक्ष बबलू जाधव एवं  युवा किसान सेना के प्रदेश अध्यकक्ष मुकेश पटवारी,['कृषक संगठन'],50,मूल्य न मिलना(Minimum Support Price(MSP)),3,7,74,8,मूल्य न मिलना(Minimum Support Price(MSP))
Sheopur,281453,31,ज्ञापन,"दिनांक 20-3-18 को  1530 बजे राष्ट्रीय किसान संगठन के जिलाध्यक्ष चतुर्भुज चक्रधारी द्वारा 35-35 की उपस्थिति में मान मुख्यि सचिव म प्र शासन के नाम एक ज्ञापन कलेक्ट्र श्यो,पुर को अपनी 11 सूत्रीय मांगो को लेकर (भावांतर भुगतान योजना, ई उपार्जन, सिंचाई सुविधा आदि) सौपा गया।",अन्‍य,1970-01-01 00:25:21.656006,जिलाध्यक्ष चतुर्भुज चक्रधारी,['कृषक संगठन'],35,भावंतर राशि,3,40,28,13,भावंतर राशि
Sheopur,281453,31,ज्ञापन,"दिनांक 20-3-18 को  1530 बजे राष्ट्रीय किसान संगठन के जिलाध्यक्ष चतुर्भुज चक्रधारी द्वारा 35-35 की उपस्थिति में मान मुख्यि सचिव म प्र शासन के नाम एक ज्ञापन कलेक्ट्र श्यो,पुर को अपनी 11 सूत्रीय मांगो को लेकर (भावांतर भुगतान योजना, ई उपार्जन, सिंचाई सुविधा आदि) सौपा गया।",अन्‍य,1970-01-01 00:25:21.656006,जिलाध्यक्ष चतुर्भुज चक्रधारी,['कृषक संगठन'],35,नहरों का पानी/सिचाई समस्या,3,40,28,7,नहरों का पानी/सिचाई समस्या
Bhopal,281770,6,अन्य सामान्य प्रकृति की समस्त छोटी मोटी घटनाएं,"दिनांक 22.3.18 को मुगलिया हाट के साइलो पर करीब 55-60 ट्राली गेंहू बिक्री हेतु किसानों द्वारा लाया गया, जिसमें 45 -50 ट्राली गेंहू क्रय किया गया l शेष गेंहू FAQ का नहीं होने से वापस कर दिया गया  l 
        वर्तमान में किसानों द्वारा बेचे जा रहे गेंहू में नमी होने के कारण F.A.Q. मापदण्ड में नहीं आने तथा शोसाइटी की तुलना में निजी व्यापारियों द्वारा राशि का शीघ्र भुगतान प्राप्त होने की उम्मीद पर , अधिकांश किसानों द्वारा प्रायवेट व्यापारियों को गेंहू बेचा जा रहा है l
             उल्लेखनीय है, कि पूर्व गेंहू खरीदी के समय सोसाइटी द्वारा ही मैसेज जनरेट किए जाते थे, किन्तु इस वर्ष मैसेज जनरेट किये जाने का कार्य एनआईसी ही किया जा रहा है l एनआईसी द्वारा इस वर्ष ऐसी व्यवस्था बनाई गई है कि 5 एकड़ या उससे अधिक भूमि वालों को पहले मैसेज किया जा रहा है  तथा कम भूमि वालों को बाद में मैसेज किया जाता है l मैसेज में किसान को दो अवसर गेंहू विक्रय हेतु दिए जा रहे हैं l समर्थन मूल्य  पर गेहूं विक्रय की वर्तमान प्रक्रिया किसानों को जटिल प्रतीत हो रही है, जिससे भोपाल जिले के 60 प्रतिशत किसानों द्वारा करोंद मंडी में निजी व्यवसाइयों को गेहूं बेचा जा रहा है l किसानों को प्राप्त हो रहा मैसेज निम्नानुसार है l 
       वर्ष 2018 के अनाज विक्रय हेतु आप कमला मीणा आत्मज इमरत लाल, किसान कोड 117280100122 को समर्थन मूल्य पर गेहू विक्रय  गेंहु की दिनांक 21/03/2018 को या 03/04/2018 को  किसान विपणन सहकारी समिति भोपाल क्र.1(करोंद मंडी भोपाल(स्टील सायलो मुगलियाकोट)),भोपाल उपार्जन केंद्र पर अपनी उपज विक्रय करे l",,1970-01-01 00:25:21.741368,अन्‍य,['कृषक संगठन'],60,मूल्य न मिलना(Minimum Support Price(MSP)),3,null,5,8,मूल्य न मिलना(Minimum Support Price(MSP))
Sehore,281905,27,नारेबाज़ी,"दिनांक-23-03-18 को 16.00 बजे कृषि उपज मण्डी श्यामपुर स्थित समर्थन मूल्य  खरीदी केंद्र पर की जा रही तुलाई नेशनल हाईवे पर स्थित गणेश वेयर हाउस पर खरीदी केंद्र बनाया गया है, जिसके विरोध में उपज लेकर आये 40-50 किसानों द्वारा  नारेबाजी की गई  एवं गेट पर खडे  होकर गेट बंद किया गया, मौके पर तहसीलदार श्यामपुर मण्डी पहॅुचे एवं किसानों से चर्चा कर केंद्र बलदने संबंधी आदेश दिखाते हुऐ समझाईश दी गई, पश्चात किसान अपने ग्राम वापस चले गये । किसानों  द्वारा कृषि उपज मण्डी श्यामपुर में ही समर्थन मूल्य का गेहॅू खरीदने की मांग की जा रही है।",अन्‍य,1970-01-01 00:25:21.810947,अन्‍य,['कृषक संगठन'],40,मूल्य न मिलना(Minimum Support Price(MSP)),3,40,5,8,मूल्य न मिलना(Minimum Support Price(MSP))
Sehore,281905,27,प्रदर्शन,"दिनांक-23-03-18 को 16.00 बजे कृषि उपज मण्डी श्यामपुर स्थित समर्थन मूल्य  खरीदी केंद्र पर की जा रही तुलाई नेशनल हाईवे पर स्थित गणेश वेयर हाउस पर खरीदी केंद्र बनाया गया है, जिसके विरोध में उपज लेकर आये 40-50 किसानों द्वारा  नारेबाजी की गई  एवं गेट पर खडे  होकर गेट बंद किया गया, मौके पर तहसीलदार श्यामपुर मण्डी पहॅुचे एवं किसानों से चर्चा कर केंद्र बलदने संबंधी आदेश दिखाते हुऐ समझाईश दी गई, पश्चात किसान अपने ग्राम वापस चले गये । किसानों  द्वारा कृषि उपज मण्डी श्यामपुर में ही समर्थन मूल्य का गेहॅू खरीदने की मांग की जा रही है।",अन्‍य,1970-01-01 00:25:21.810947,अन्‍य,['कृषक संगठन'],40,मूल्य न मिलना(Minimum Support Price(MSP)),3,40,5,8,मूल्य न मिलना(Minimum Support Price(MSP))
Khandwa,282070,24,अन्य,"दिनांक 25/03/18 से भारतीय किसान संघ के जिलाध्यक्ष धरमचंद पटेल एवं पंधाना ब्लॉक अध्यक्ष भूपेन्द्र कुशवाह के नेतृत्व में कस्बा पंधाना स्थित गांधी चौक पर प्रातः 10.00 बजे से जिले के किसानो की समस्या जैसे किसानो का कर्ज मुक्त किया जाये, पंधाना क्षेत्र में भगवंत सागर डेम से बचे हुये क्षेत्र के किसानो के खेत तक नहर निर्माण कर सिचाई हेतु पानी पहॅुचाया जाये, प्याज  20 रु प्रति किलो खरीदा जाये, प्रत्येक फसलो के दाम किसानो द्वारा तय किया जाये, समर्थन मूल्य पर खरीदी 01 मार्च से प्रारंभ किया जाये आदि मांगो  को लेकर अनिश्चितकालीन धरना दिये जाने की योजना है ।",भाकिस,1970-01-01 00:25:21.825175,भारतीय किसान संघ के जिलाध्यक्ष धरमचंद पटेल एवं पंधाना ब्लॉक अध्यक्ष भूपेन्द्र कुशवाह,['कृषक संगठन'],0,नहरों का पानी/सिचाई समस्या,3,2,84,7,नहरों का पानी/सिचाई समस्या
