district,id,district_id,incident_type,incident,organization,time,leadername,organization_type,intotal,demand,organization_type_id,organization_id,leadername1,demand_id,demand_clean
Ratlam,584055,45,भ्रमण,"इसी प्रकार डॉ. अजय मल्होत्रा ने कहा गया कि- किसानों को आप लंबा आंदोलन करने के लिए मजबूत कर रहे हैं। इसे इतना लंबा कर दीजिए कि 2023-2024 के दौरान हम किसान सड़कों पर बैठे रहे हैं ताकि आपसे हमें दोबारा लड़ने की जरूरत ना पड़े। वर्तमान में केंद्र तथा राज्य सरकार कोरोना-कोरोना कह रही है। कोई कोरोना नहीं है। हम 03 महीने से किसान आंदोलन कर रहे हैं। कोई कोरोना नहीं हुआ। यह केंद्र सरकार केवल किसान आंदोलन को रोकने/निरस्त करने के लिए यह कोरोना का झूठ फैला रही है। मैं मध्यप्रदेश के रतलाम रत्नों तथा इस देश के वीरों, वीरांगनाओं को बोलने की आजादी मिली है, मैं वचन देता देता हूं, वादा करता हूं कि पूरे देश को एक सूत्र में पिरो कर इस तरह के षड्यंत्र की सरकार के विरोध में हमने आवाज उठाई है और जो बीड़ा उठाया है। हम किसानों के बेटे हैं बस हमें ललकार दीजिए हम प्राण दे दिया करेंगे, आपकी आवाजों पर।
 	इसी प्रकार म.प्र. कृषक समाज अध्यक्ष एवं पूर्व कांग्रेस प्रदेशाध्यक्ष अरुण यादव ने कहा कि- आज दिल्ली की सड़कों पर लाखों की तादाद में हमारा अन्नदाता संघर्ष कर रहा है। जो केंद्र की भाजपा सरकार ने थोपने का कार्य किया है। किसान आंदोलन में 80 से ज्यादा किसानों की मृत्यु हो गई, उन्हें याद करना है। लड़ाई लंबी है, हमें भी सब मिलकर कंधे से कंधा मिलाकर साथ देना है। यह काला कानून देश के किसानों को उद्योगपतियों के गिरवे रखने का कानून आया है। एमएसपी में कार्रवाई करने का नियम इस कानून में नहीं है। प्रदेश के कृषि मंत्रीजी के भतीजे जो हरदा में रहते हैं जिनका सोयाबीन मक्का का 24 लाख रुपये लेकर एक व्यापारी रफू चक्कर हो गया। जब कृषि मंत्रीजी का भतीजा सुरक्षित नहीं है तो हमारा क्या होगा?",कांग्रेस,1970-01-01 00:26:54.882270,पूर्व मुख्यमंत्री श्री दिग्विजय सिंह,"['राजनैतिक पार्टी', 'कृषक संगठन']",80,मूल्य न मिलना(Minimum Support Price(MSP)),1,9,36,8,मूल्य न मिलना(Minimum Support Price(MSP))
Ratlam,584055,45,भ्रमण,"इसी प्रकार डॉ. अजय मल्होत्रा ने कहा गया कि- किसानों को आप लंबा आंदोलन करने के लिए मजबूत कर रहे हैं। इसे इतना लंबा कर दीजिए कि 2023-2024 के दौरान हम किसान सड़कों पर बैठे रहे हैं ताकि आपसे हमें दोबारा लड़ने की जरूरत ना पड़े। वर्तमान में केंद्र तथा राज्य सरकार कोरोना-कोरोना कह रही है। कोई कोरोना नहीं है। हम 03 महीने से किसान आंदोलन कर रहे हैं। कोई कोरोना नहीं हुआ। यह केंद्र सरकार केवल किसान आंदोलन को रोकने/निरस्त करने के लिए यह कोरोना का झूठ फैला रही है। मैं मध्यप्रदेश के रतलाम रत्नों तथा इस देश के वीरों, वीरांगनाओं को बोलने की आजादी मिली है, मैं वचन देता देता हूं, वादा करता हूं कि पूरे देश को एक सूत्र में पिरो कर इस तरह के षड्यंत्र की सरकार के विरोध में हमने आवाज उठाई है और जो बीड़ा उठाया है। हम किसानों के बेटे हैं बस हमें ललकार दीजिए हम प्राण दे दिया करेंगे, आपकी आवाजों पर।
 	इसी प्रकार म.प्र. कृषक समाज अध्यक्ष एवं पूर्व कांग्रेस प्रदेशाध्यक्ष अरुण यादव ने कहा कि- आज दिल्ली की सड़कों पर लाखों की तादाद में हमारा अन्नदाता संघर्ष कर रहा है। जो केंद्र की भाजपा सरकार ने थोपने का कार्य किया है। किसान आंदोलन में 80 से ज्यादा किसानों की मृत्यु हो गई, उन्हें याद करना है। लड़ाई लंबी है, हमें भी सब मिलकर कंधे से कंधा मिलाकर साथ देना है। यह काला कानून देश के किसानों को उद्योगपतियों के गिरवे रखने का कानून आया है। एमएसपी में कार्रवाई करने का नियम इस कानून में नहीं है। प्रदेश के कृषि मंत्रीजी के भतीजे जो हरदा में रहते हैं जिनका सोयाबीन मक्का का 24 लाख रुपये लेकर एक व्यापारी रफू चक्कर हो गया। जब कृषि मंत्रीजी का भतीजा सुरक्षित नहीं है तो हमारा क्या होगा?",कांग्रेस,1970-01-01 00:26:54.882270,पूर्व मुख्यमंत्री श्री दिग्विजय सिंह,"['राजनैतिक पार्टी', 'कृषक संगठन']",80,मूल्य न मिलना(Minimum Support Price(MSP)),3,9,36,8,मूल्य न मिलना(Minimum Support Price(MSP))
Bhopal,584493,6,अन्य,दिनांक 6 मार्च 21 को राष्ट्रीय किसान संगठन  के प्रदेश प्रवक्ता परमजीत सिंह द्वारा इंडियन कॉफी हाउस न्यू मार्केट में समय 13:00 बजे से 13:15 बजे तक एक पत्रकार वार्ता आयोजित कर कहा कि प्रदेश में रवि की फसल कटाई पिछले 20 दिनों से आरंभ हो चुकी है तथा किसान अपनी रवि की फसल बेचने मंडी में आ रहे हैं किसी भी किसान को केंद्र सरकार के द्वारा घोषित न्यूनतम समर्थन मूल्य का लाभ नहीं मिल पा रहा है केंद्र सरकार द्वारा वर्ष 2021 और 2022 में चना तथा मशहूर कर समर्थन मूल्य ₹5100 प्रति कुंटल एवं गेहूं का 1975 रुपए प्रति कुंतल घोषित किया है किंतु मंडी में गेहूं व्यापारियों द्वारा 15:00 सौ से 1675 रुपए एवं चना 4500 से ₹4800 प्रति कुंतल के भाव से खरीदा जा रहा है न्यूनतम समर्थन मूल्य से काफी कम है जो सरकार के दावों  की पोल  खोलकर रखता है प्रदेश में वर्ष 2018 एवं 19 में घोषित गेहूं पर बोनस का पैसा अभी तक प्राप्त नहीं हुआ है अगर शीघ्र ही सरकार द्वारा मंडी में हस्तक्षेप कर किसानों से घोषित समर्थन मूल्य पर रवि की फसल नहीं खरीदी जाती है तो हम 8 मार्च 21 को प्रदेश की सभी मंडियों को 1 दिन के लिए बंद करेंगे अगर इसके बाद भी सरकार समर्थन मूल्य पर कम खरीदी रोकने में असफल रहती है तो राष्ट्रीय किसान संगठन और भी आंदोलन करेगा।,अन्‍य,1970-01-01 00:26:55.044487,अन्‍य,['कृषक संगठन'],15,मूल्य न मिलना(Minimum Support Price(MSP)),3,40,5,8,मूल्य न मिलना(Minimum Support Price(MSP))
Barwani,584560,4,ज्ञापन,"आज दिनांक 06.03.21 को राष्ट्रीय किसान मजदूर महासंघ व संयुक्त किसान मोर्चा के आह्वान पर तीनों कृषि कानूनों को रद्द करवाने व समर्थन मूल्य पर ग्या रंटी कानून बनाने के लिए जो दिल्ली में किसान आंदोलन कर रहे हैं उन्हें 100 दिन पूरे होने पर हर तहसील स्तर पर राष्ट्रपति के नाम ज्ञापन एसडीएम को सौंपे जाने का आव्हान किया गया है जिसमें किसानों को संगठन के झंडे के साथ हाथ में काला झंडा व हाथों पर काली पट्टी बांधकर अपना विरोध करने के निर्देश दिये गये । 
            उक्त कार्यक्रम के तहत दिनांक 06.03.21 को बडवानी जिला मुख्यालय पर राष्ट्रीय किसान मजदूर महासंघ के जिला अध्यक्ष मदन मुलेवा के नेतृत्व में 04-05 कार्यकर्ताओ के द्वारा 13.25 बजे कलेक्टर कार्यालय पहुचकर महामहिम राष्ट्रपति महोदय को संबोधित एक ज्ञापन तहसीलदार बडवानी को सौपा गया।
           इसी प्रकार कस्बा राजपुर में राष्ट्रीय किसान मजदूर महासंघ के राजपुर तहसील अध्यक्ष पवन परिहार के नेतृत्व में 08-10 कार्यकर्ताओ के द्वारा 13.30 बजे तहसील कार्यालय राजपुर पहुचकर एक ज्ञापन नायब तहसीलदार राजपुर को दिया गया। 
             इसी प्रकार कस्बा अंजड में राष्ट्रीय किसान मजदूर महासंघ के जिला उपाध्यक्ष रविन्द्र पाटीदार के नेतृत्व में 05-06 कार्यकर्ताओ के द्वारा 16.00 बजे तहसील कार्यालय अंजड पहुचकर एक ज्ञापन तहसीलदार अंजड को दिया गया।",राष्ट्री य किसान मजदूर महासंघ ( कक्‍काजी गुट ),1970-01-01 00:26:55.048227,मदन मुलेवा,['कृषक संगठन'],8,मूल्य न मिलना(Minimum Support Price(MSP)),3,39,10,8,मूल्य न मिलना(Minimum Support Price(MSP))
Khandwa,584608,24,ज्ञापन,"दिनांक 06.03.21 को राष्ट्रीय किसान मजदूर महासंघ व संयुक्त किसान मोर्चा के आह्वान पर तीनों कृषी कानूनों को रद्द करवाने व समर्थन मूल्य पर ग्यानरंटी कानून बनाने के लिए जो दिल्ली में किसान आंदोलन कर रहे हैं उन्हें 100 दिन पूरे होने पर हर तहसील स्तर पर राष्ट्रपति के नाम ज्ञापन एसडीएम को सौंपे जाने का आव्हा्न किया गया है जिसमें किसानों को संगठन के झंडे के साथ हाथ में काला झंडा व हाथों पर काली पट्टी बांधकर अपना विरोध करने के निर्देश दिये गये है । 
जिला खण्डीवा से - दिनांक 06.03.21 को राष्ट्रीय किसान मजदूर महासंघ के जिलाध्य क्ष सौरभ कुशवाह  के नेतृत्वक में दोपहर 12:30 बजे कलेक्ट र कार्यालय खण्डावा पहॅुचकर महामहिम राष्ट्रुपति महोदय को संबोधित एक ज्ञापन डिप्टीध कलेक्ट र श्रीमती अनुभा जैन को सौपा गया।  कार्यक्रम में लगभग 7-8 की उपस्थिति रही।",अन्‍य,1970-01-01 00:26:55.051118,राष्ट्रीय किसान मजदूर महासंघ के जिलाध्येक्ष सौरभ कुशवाह,['कृषक संगठन'],7,मूल्य न मिलना(Minimum Support Price(MSP)),3,40,55,8,मूल्य न मिलना(Minimum Support Price(MSP))
Khargone,584647,25,ज्ञापन,"आज दिनांक 06.03.21 को राष्ट्रीय किसान मजदूर महासंघ व संयुक्त किसान मोर्चा के आह्वान पर तीनों कृषी कानूनों को रद्द करवाने व समर्थन मूल्य पर ग्‍यारंटी कानून बनाने के लिए जो दिल्ली में किसान आंदोलन कर रहे हैं उन्हें 100 दिन पूरे होने पर एवं अपनी स्‍थानीय समस्‍याओं को लेकर तहसील स्तर पर राष्ट्रपति के नाम ज्ञापन एसडीएम को सौंपे जाने का आव्‍हान किया गया है जिसमें किसानों को संगठन के झंडे के साथ हाथ में काला झंडा व हाथों पर काली पट्टी बांधकर अपना विरोध करने के निर्देश दिये गये है । उक्‍त आव्‍हान अंतर्गत आज दिनांक 06.03.21 के दोप. 15:30 बजे जिला खरगोन के कस्‍बा कसरावद में राष्‍ट्रीय किसान मजदूर महासंघ के जिला संयोजक विक्रम पटेल के नेतृत्‍व में 15-20 किसानों ने हाथों पर काली पट्टी बांध कर एसडीएम कसरावद को संबोधित एक ज्ञापन एसडीएम कसरावद को सौंपा गया ।
	इसी प्रकार आज दिनांक 06.03.21 के दोप. 13:00 बजे जिला खरगोन के कस्‍बा मण्‍डलेश्‍वर में तहसील संयोजक हरिराम पाटीदार के नेतृत्‍व में 8-10 किसानों ने माननीय मुख्‍यमंत्री महोदय को संबोधित एक ज्ञापन एसडीएम कार्यालय में दिया गया । 
	इसी प्रकार आज दिनांक 06.03.21 के दोप. 12:00 बजे जिला खरगोन के कस्‍बा बडवाह में संभाग उपाध्‍यक्ष देवनारायण पटेल के नेतृत्‍व में 8-10 किसानों के नेतृत्‍व में माननीय मुख्‍यमंत्री महोदय को संबोधित एक ज्ञापन एसडीएम बडवाह को सौंपा गया । 
	जिला मुख्‍यालय खरगोन में राष्‍ट्रीय किसान मजदूर महासंघ के जिला मंत्री अश्‍वीन तोमर के नेतृत्‍व में प्रस्‍तावित ज्ञापन कार्यक्रम अपरिहार्य कारणों से निरस्‍त हो गया ।",अन्‍य,1970-01-01 00:26:55.053773,विक्रम पटेल,['कृषक संगठन'],20,मूल्य न मिलना(Minimum Support Price(MSP)),3,40,11,8,मूल्य न मिलना(Minimum Support Price(MSP))
Shivpuri,584742,32,अन्य,"आज दिनांक 07-03-21 को क़स्बा खनियांधाना क्षेत्र के ग्राम देवखो टपरियन, मोटा, जेरा के ग्रामीणों द्वारा सिंचाई के लिए बुधना डेम से नहर खोले जाने की मांग को लेकर धर्मेन्द्र सिंह चौहान के नेतृत्व में प्रातः 09:00 बजे ग्राम देवखो तिराहा रोड़ पर 65-70 की संख्या में एकत्रित होकर चक्का्जाम कर दिया गया, बाद थाना प्रभारी खनियाधाना, नायब तहसीलदार श्री अरूण गुर्जर एवं एसडीएम श्री आर0के0 चौकीकर द्वारा 01 दिन में नहर का निराकरण किये जाने के आश्वासन उपरांत 13:10 बजे चक्काजाम खोला गया।
उल्लेखनीय है कि ग्राम देवखो में पहाड़ी क्षेत्र से बुधना डेम तालाब में पानी एकठ्ठा होता है जिससे आसपास के क्षेत्र में नहर द्वारा 2500-3000 बीघा जमीन सिंचित होती है, किन्तु वर्तमान में नगरपरिषद खनियाधना को पाइप लाइन से पेयजल हेतु पानी सप्लाई किये जाने के कारण से लगभग 20 दिन से नहर बंद कर दी गई है, जिससे ग्रामीणों को सिंचाई में परेशानी का सामना करना पड़ रहा है। जबकि बुधना डेम तालाब में काफ़ी मात्रा में पानी भरा है एवं सिचाई विभाग एसडीओपी विकास तिवारी को ग्रामीणों ने कई बार नहर खोलने का आवेदन देने के बाद भी वर्तमान तक नहर नहीं खाले जाने के कारण से किसान परेशान हैं।",अन्‍य,1970-01-01 00:26:55.123576,धर्मेन्द्रसिंह चौहान,['कृषक संगठन'],70,नहरों का पानी/सिचाई समस्या,3,40,20,7,नहरों का पानी/सिचाई समस्या
Dewas,584781,44,बैठक,"देवास जिले तहसील कस्बा हाटपिपल्या , बागली, उदयनगर, सतवास में सिंचाई परियोजना डीपीआर तैयार की गई थी उस डीपीआर को प्रशासनिक मंजूरी नही दी जा रही है। जिसको लेकर दिनांक 07-03-21 को 12:30 से 13:00 बजे तक भारतीय किसान संघ के जिलाध्यीक्ष गोवर्धन लाल पाटीदार के नेतृत्वी में लगभग 20 की संख्याे में भू स्प0रूपा एफ पी ओ चापडा में एक बैठक आयोजित की गई । बैठक में आगामी रणनीति पर विचार विर्मश किया गया । इस अवसर मुख्यर रूप से भारतीय किसान संघ के प्रदेश उपाध्यिक्ष रामप्रसाद सूर्या उपस्थित रहे।",भारतीय किसान संघ,1970-01-01 00:26:55.130109,गोवर्धन लाल पाटीदार,['कृषक संगठन'],20,नहरों का पानी/सिचाई समस्या,3,2,19,7,नहरों का पानी/सिचाई समस्या
